{
  "accepts_object_type": "native_kv_page",
  "engine_profile": {
    "attention_impl": "flash_attention_2",
    "block_size_tokens": 256,
    "engine_name": "bifrost-reference",
    "engine_version": "0.1.0-fixture",
    "integration_name": "bifrost-python-reference",
    "integration_version": "0.1.0-fixture",
    "kv_cache_format": "native_kv_pair_v1",
    "kv_layout": "kv_token_head_dim"
  },
  "model_profile": {
    "config_hash": "blake3:2b0aa2df414f30ac51640566f6f2911b0deea8027d59fda57611bb72598159be",
    "dtype": "float16",
    "head_dim": 64,
    "max_position_embeddings": 8192,
    "model_hash": "blake3:b31dc7f5e94ff0290a04b7eaf3d1dda0c3036ac80682e5aecc658ccb46b4aefa",
    "model_id": "tiny-gpt",
    "model_revision": "local",
    "num_attention_heads": 12,
    "num_kv_heads": 12,
    "num_layers": 12,
    "quantization": "none",
    "rope_config_hash": "blake3:f27e0d4cd6df04c819b1541504d7886f5b1d320ee2efb3f5dc0f684d78353ebe",
    "tokenizer_hash": "blake3:7a96ceadf37d65c8bdc3bcd40f954bf7361e40828fe5d202769fda3746610750"
  },
  "opaque_requirements": null,
  "prefix_requirements": {
    "absolute_position_range": {
      "end": 2048,
      "start": 1792
    },
    "allow_mm_hashes": [],
    "prefix_hash": "blake3:2fb44b50964045c39d1ee2869bfb4b6962478de72b6325fd5ea5decf4e68c6a4",
    "rope_config_hash": "blake3:f27e0d4cd6df04c819b1541504d7886f5b1d320ee2efb3f5dc0f684d78353ebe",
    "token_hash": "blake3:65bcf9510a74918b767acee13a31623594b55369bdf78ec0cb265cec948f0c8d",
    "token_range": {
      "end": 2048,
      "start": 1792
    },
    "tokenizer_hash": "blake3:7a96ceadf37d65c8bdc3bcd40f954bf7361e40828fe5d202769fda3746610750"
  },
  "schema_version": "bifrost.target_profile.v1alpha1"
}
